Title,Rating,Price,Stock
A Light in the ...,Three,£51.77,In stock
Tipping the Velvet,One,£53.74,In stock
Soumission,One,£50.10,In stock
Sharp Objects,Four,£47.82,In stock
Sapiens: A Brief History ...,Five,£54.23,In stock
The Requiem Red,One,£22.65,In stock
The Dirty Little Secrets ...,Four,£33.34,In stock
The Coming Woman: A ...,Three,£17.93,In stock
The Boys in the ...,Four,£22.60,In stock
The Black Maria,One,£52.15,In stock
Starving Hearts (Triangular Trade ...,Two,£13.99,In stock
Shakespeare's Sonnets,Four,£20.66,In stock
Set Me Free,Five,£17.46,In stock
Scott Pilgrim's Precious Little ...,Five,£52.29,In stock
Rip it Up and ...,Five,£35.02,In stock
Our Band Could Be ...,Three,£57.25,In stock
Olio,One,£23.88,In stock
Mesaerion: The Best Science ...,One,£37.59,In stock
Libertarianism for Beginners,Two,£51.33,In stock
It's Only the Himalayas,Two,£45.17,In stock
In Her Wake,One,£12.84,In stock
How Music Works,Two,£37.32,In stock
Foolproof Preserving: A Guide ...,Three,£30.52,In stock
Chase Me (Paris Nights ...,Five,£25.27,In stock
Black Dust,Five,£34.53,In stock
Birdsong: A Story in ...,Three,£54.64,In stock
America's Cradle of Quarterbacks: ...,Three,£22.50,In stock
Aladdin and His Wonderful ...,Three,£53.13,In stock
Worlds Elsewhere: Journeys Around ...,Five,£40.30,In stock
Wall and Piece,Four,£44.18,In stock
The Four Agreements: A ...,Five,£17.66,In stock
The Five Love Languages: ...,Three,£31.05,In stock
The Elephant Tree,Five,£23.82,In stock
The Bear and the ...,One,£36.89,In stock
Sophie's World,Five,£15.94,In stock
Penny Maybe,Three,£33.29,In stock
Maude (1883-1993):She Grew Up ...,Two,£18.02,In stock
"In a Dark, Dark ...",One,£19.63,In stock
Behind Closed Doors,Four,£52.22,In stock
You can't bury them ...,Two,£33.63,In stock
Slow States of Collapse: ...,Three,£57.31,In stock
Reasons to Stay Alive,Two,£26.41,In stock
Private Paris (Private #10),Five,£47.61,In stock
#HigherSelfie: Wake Up Your ...,Five,£23.11,In stock
Without Borders (Wanderlove #1),Two,£45.07,In stock
When We Collided,One,£31.77,In stock
"We Love You, Charlie ...",Five,£50.27,In stock
Untitled Collection: Sabbath Poems ...,Four,£14.27,In stock
Unseen City: The Majesty ...,Four,£44.18,In stock
Unicorn Tracks,Three,£18.78,In stock
Unbound: How Eight Technologies ...,One,£25.52,In stock
Tsubasa: WoRLD CHRoNiCLE 2 ...,One,£16.28,In stock
Throwing Rocks at the ...,Three,£31.12,In stock
This One Summer,Four,£19.49,In stock
Thirst,Five,£17.27,In stock
The Torch Is Passed: ...,One,£19.09,In stock
The Secret of Dreadwillow ...,One,£56.13,In stock
The Pioneer Woman Cooks: ...,One,£56.41,In stock
The Past Never Ends,Four,£56.50,In stock
The Natural History of ...,Three,£45.22,In stock
The Nameless City (The ...,Four,£38.16,In stock
The Murder That Never ...,Three,£54.11,In stock
The Most Perfect Thing: ...,Four,£42.96,In stock
The Mindfulness and Acceptance ...,Four,£23.89,In stock
The Life-Changing Magic of ...,Three,£16.77,In stock
The Inefficiency Assassin: Time ...,Five,£20.59,In stock
The Gutsy Girl: Escapades ...,One,£37.13,In stock
The Electric Pencil: Drawings ...,One,£56.06,In stock
The Death of Humanity: ...,Four,£58.11,In stock
The Bulletproof Diet: Lose ...,Three,£49.05,In stock
The Art Forger,Three,£40.76,In stock
The Age of Genius: ...,One,£19.73,In stock
The Activist's Tao Te ...,Five,£32.24,In stock
Spark Joy: An Illustrated ...,Four,£41.83,In stock
Soul Reader,Two,£39.58,In stock
Security,Two,£39.25,In stock
"Saga, Volume 6 (Saga ...",Three,£25.02,In stock
"Saga, Volume 5 (Saga ...",Two,£51.04,In stock
Reskilling America: Learning to ...,Two,£19.83,In stock
"Rat Queens, Vol. 3: ...",Three,£50.40,In stock
"Princess Jellyfish 2-in-1 Omnibus, ...",Five,£13.61,In stock
Princess Between Worlds (Wide-Awake ...,Five,£13.34,In stock
"Pop Gun War, Volume ...",One,£18.97,In stock
"Political Suicide: Missteps, Peccadilloes, ...",Two,£36.28,In stock
Patience,Three,£10.16,In stock
"Outcast, Vol. 1: A ...",Four,£15.44,In stock
orange: The Complete Collection ...,One,£48.41,In stock
Online Marketing for Busy ...,One,£46.35,In stock
On a Midnight Clear,Three,£14.07,In stock
Obsidian (Lux #1),Two,£14.86,In stock
My Paris Kitchen: Recipes ...,Two,£33.37,In stock
Masks and Shadows,Two,£56.40,In stock
Mama Tried: Traditional Italian ...,Four,£14.02,In stock
"Lumberjanes, Vol. 2: Friendship ...",Two,£46.91,In stock
"Lumberjanes, Vol. 1: Beware ...",Three,£45.61,In stock
Lumberjanes Vol. 3: A ...,Two,£19.92,In stock
"Layered: Baking, Building, and ...",One,£40.11,In stock
Judo: Seven Steps to ...,Two,£53.90,In stock
Join,Five,£35.67,In stock
In the Country We ...,Four,£22.00,In stock
Immunity: How Elie Metchnikoff ...,Five,£57.36,In stock
"I Hate Fairyland, Vol. ...",Two,£29.17,In stock
I am a Hero ...,Three,£54.63,In stock
How to Be Miserable: ...,One,£46.03,In stock
Her Backup Boyfriend (The ...,One,£33.97,In stock
"Giant Days, Vol. 2 ...",Two,£22.11,In stock
Forever and Forever: The ...,Three,£29.69,In stock
First and First (Five ...,Four,£15.97,In stock
Fifty Shades Darker (Fifty ...,One,£21.96,In stock
Everydata: The Misinformation Hidden ...,Two,£54.35,In stock
Don't Be a Jerk: ...,Two,£37.97,In stock
Danganronpa Volume 1,Four,£51.99,In stock
Crown of Midnight (Throne ...,Three,£43.29,In stock
"Codename Baboushka, Volume 1: ...",Four,£36.72,In stock
Camp Midnight,Four,£17.08,In stock
Call the Nurse: True ...,Five,£29.14,In stock
Burning,Three,£28.81,In stock
Bossypants,Two,£49.46,In stock
"Bitch Planet, Vol. 1: ...",Two,£37.92,In stock
Avatar: The Last Airbender: ...,Two,£28.09,In stock
Algorithms to Live By: ...,One,£30.81,In stock
A World of Flavor: ...,One,£42.95,In stock
"A Piece of Sky, ...",Five,£56.76,In stock
A Murder in Time,One,£16.64,In stock
A Flight of Arrows ...,Five,£55.53,In stock
A Fierce and Subtle ...,Four,£28.13,In stock
A Court of Thorns ...,One,£52.37,In stock
(Un)Qualified: How God Uses ...,Five,£54.00,In stock
You Are What You ...,Four,£21.87,In stock
William Shakespeare's Star Wars: ...,Four,£43.30,In stock
Tuesday Nights in 1980,Two,£21.04,In stock
Tracing Numbers on a ...,Three,£41.60,In stock
Throne of Glass (Throne ...,Three,£35.07,In stock
Thomas Jefferson and the ...,One,£59.64,In stock
Thirteen Reasons Why,One,£52.72,In stock
The White Cat and ...,Four,£58.08,In stock
The Wedding Dress,One,£24.12,In stock
The Vacationers,Four,£42.15,In stock
The Third Wave: An ...,Five,£12.61,In stock
The Stranger,Four,£17.44,In stock
The Shadow Hero (The ...,One,£33.14,In stock
The Secret (The Secret ...,Four,£27.37,In stock
The Regional Office Is ...,Five,£51.36,In stock
The Psychopath Test: A ...,Two,£36.00,In stock
The Project,One,£10.65,In stock
The Power of Now: ...,Two,£43.54,In stock
The Omnivore's Dilemma: A ...,Two,£38.21,In stock
The Nerdy Nummies Cookbook: ...,Five,£37.34,In stock
The Murder of Roger ...,Four,£44.10,In stock
The Mistake (Off-Campus #2),Three,£43.29,In stock
The Matchmaker's Playbook (Wingmen ...,One,£55.85,In stock
The Love and Lemons ...,Two,£37.60,In stock
The Long Shadow of ...,One,£10.97,In stock
The Kite Runner,Four,£41.82,In stock
The House by the ...,One,£36.95,In stock
The Glittering Court (The ...,One,£44.28,In stock
The Girl on the ...,Two,£55.02,In stock
The Genius of Birds,One,£17.24,In stock
The Emerald Mystery,Two,£23.15,In stock
The Cookies & Cups ...,One,£41.25,In stock
The Bridge to Consciousness: ...,Three,£32.00,In stock
The Artist's Way: A ...,Five,£38.49,In stock
The Art of War,Five,£33.34,In stock
The Argonauts,Two,£10.93,In stock
The 10% Entrepreneur: Live ...,Three,£27.55,In stock
Suddenly in Love (Lake ...,Two,£55.99,In stock
Something More Than This,Four,£16.24,In stock
Soft Apocalypse,Two,£26.12,In stock
So You've Been Publicly ...,Two,£12.23,In stock
Shoe Dog: A Memoir ...,Two,£23.99,In stock
"Shobu Samurai, Project Aryoku ...",Three,£29.06,In stock
Secrets and Lace (Fatal ...,One,£20.27,In stock
Scarlett Epstein Hates It ...,Five,£43.55,In stock
Romero and Juliet: A ...,One,£36.94,In stock
Redeeming Love,Five,£20.47,In stock
Poses for Artists Volume ...,One,£41.06,In stock
Poems That Make Grown ...,Four,£14.19,In stock
"Nightingale, Sing",One,£38.28,In stock
Night Sky with Exit ...,One,£41.05,In stock
Mrs. Houdini,Five,£30.25,In stock
Modern Romance,Five,£28.26,In stock
Miss Peregrine’s Home for ...,One,£10.76,In stock
Louisa: The Extraordinary Life ...,Two,£16.85,In stock
Little Red,Three,£13.47,In stock
Library of Souls (Miss ...,Five,£48.56,In stock
Large Print Heart of ...,Two,£19.15,In stock
I Had a Nice ...,Four,£57.36,In stock
Hollow City (Miss Peregrine’s ...,One,£42.98,In stock
Grumbles,Two,£22.16,In stock
Full Moon over Noah’s ...,Four,£49.43,In stock
Frostbite (Vampire Academy #2),Five,£29.99,In stock
Follow You Home,One,£21.36,In stock
First Steps for New ...,One,£29.00,In stock
Finders Keepers (Bill Hodges ...,Five,£53.53,In stock
"Fables, Vol. 1: Legends ...",Four,£41.62,In stock
Eureka Trivia 6.0,Four,£54.59,In stock
Drive: The Surprising Truth ...,Four,£34.95,In stock
Done Rubbed Out (Reightman ...,Five,£37.72,In stock
Doing It Over (Most ...,Three,£35.61,In stock
Deliciously Ella Every Day: ...,Three,£42.16,In stock
Dark Notes,Five,£19.19,In stock
Daring Greatly: How the ...,Three,£19.43,In stock
Close to You,Four,£49.46,In stock
Chasing Heaven: What Dying ...,Two,£37.80,In stock
Big Magic: Creative Living ...,Three,£30.80,In stock
Becoming Wise: An Inquiry ...,Two,£27.43,In stock
Beauty Restored (Riley Family ...,Two,£11.11,In stock
Batman: The Long Halloween ...,Two,£36.50,In stock
Batman: The Dark Knight ...,Five,£15.38,In stock
Ayumi's Violin,Two,£15.48,In stock
Anonymous,Four,£46.82,In stock
Amy Meets the Saints ...,Three,£18.46,In stock
Amid the Chaos,One,£36.58,In stock
Amatus,Five,£50.54,In stock
Agnostic: A Spirited Manifesto,Five,£12.51,In stock
Zealot: The Life and ...,Three,£24.70,In stock
You (You #1),Five,£43.61,In stock
"Wonder Woman: Earth One, ...",Four,£37.34,In stock
Wild Swans,Two,£14.36,In stock
Why the Right Went ...,Four,£52.65,In stock
Whole Lotta Creativity Going ...,Four,£38.20,In stock
What's It Like in ...,Two,£19.60,In stock
"We Are Robin, Vol. ...",One,£53.90,In stock
Walt Disney's Alice in ...,Five,£12.96,In stock
V for Vendetta (V ...,Four,£37.10,In stock
Until Friday Night (The ...,Two,£46.31,In stock
Unbroken: A World War ...,Two,£45.95,In stock
Twenty Yawns,Two,£22.08,In stock
Through the Woods,Two,£25.38,In stock
This Is Where It ...,Two,£27.12,In stock
The Year of Magical ...,Two,£43.04,In stock
The Wright Brothers,Four,£56.80,In stock
The White Queen (The ...,Five,£25.91,In stock
The Wedding Pact (The ...,Three,£32.61,In stock
The Time Keeper,Five,£27.88,In stock
The Testament of Mary,Four,£52.67,In stock
The Star-Touched Queen,Five,£46.02,In stock
The Songs of the ...,Five,£44.48,In stock
The Song of Achilles,Five,£37.40,In stock
The Rosie Project (Don ...,One,£54.04,In stock
The Power of Habit: ...,Three,£16.88,In stock
The Marriage of Opposites,Four,£28.08,In stock
The Lucifer Effect: Understanding ...,One,£10.40,In stock
The Long Haul (Diary ...,One,£44.07,In stock
The Loney,One,£23.40,In stock
The Literature Book (Big ...,Three,£17.43,In stock
The Last Mile (Amos ...,Two,£54.21,In stock
The Immortal Life of ...,Two,£40.67,In stock
The Hidden Oracle (The ...,Two,£52.26,In stock
The Help Yourself Cookbook ...,Three,£28.77,In stock
The Guilty (Will Robie ...,Two,£13.82,In stock
The First Hostage (J.B. ...,Three,£25.85,In stock
The Dovekeepers,One,£48.78,In stock
The Darkest Lie,Five,£35.35,In stock
The Bane Chronicles (The ...,Four,£44.73,In stock
The Bad-Ass Librarians of ...,One,£15.77,In stock
The 14th Colony (Cotton ...,One,£39.24,In stock
That Darkness (Gardiner and ...,One,£13.92,In stock
Tastes Like Fear (DI ...,One,£10.69,In stock
Take Me with You,Three,£45.21,In stock
Swell: A Year of ...,One,£45.58,In stock
Superman Vol. 1: Before ...,Five,£11.89,In stock
Still Life with Bread ...,Three,£26.41,In stock
Steve Jobs,Five,£39.50,In stock
Sorting the Beef from ...,Four,£44.74,In stock
Someone Like You (The ...,Five,£52.79,In stock
"So Cute It Hurts!!, ...",Four,£35.43,In stock
Shtum,Four,£55.84,In stock
See America: A Celebration ...,Three,£48.87,In stock
salt.,Four,£46.78,In stock
Robin War,Three,£47.82,In stock
"Red Hood/Arsenal, Vol. 1: ...",Two,£25.48,In stock
Rain Fish,Three,£23.57,In stock
Quarter Life Poetry: Poems ...,Five,£50.89,In stock
Pet Sematary,Three,£10.56,In stock
"Overload: How to Unplug, ...",Three,£52.15,In stock
Once Was a Time,Two,£18.28,In stock
Old School (Diary of ...,Five,£11.83,In stock
No Dream Is Too ...,Two,£21.95,In stock
"Naruto (3-in-1 Edition), Vol. ...",Two,£38.39,In stock
My Name Is Lucy ...,One,£41.56,In stock
My Mrs. Brown,Three,£24.48,In stock
My Kind of Crazy,One,£40.36,In stock
Mr. Mercedes (Bill Hodges ...,One,£28.90,In stock
More Than Music (Chasing ...,Two,£37.61,In stock
Made to Stick: Why ...,Five,£38.85,In stock
Luis Paints the World,Three,£53.95,In stock
Luckiest Girl Alive,Three,£49.83,In stock
Lowriders to the Center ...,Two,£51.51,In stock
Love Is a Mix ...,One,£18.03,In stock
Looking for Lovely: Collecting ...,Five,£29.14,In stock
Living Leadership by Insight: ...,Four,£46.91,In stock
Let It Out: A ...,Five,£26.79,In stock
Lady Midnight (The Dark ...,Five,£16.28,In stock
"It's All Easy: Healthy, ...",One,£19.55,In stock
Island of Dragons (Unwanteds ...,One,£29.65,In stock
I Know What I'm ...,Four,£25.98,In stock
I Am Pilgrim (Pilgrim ...,Four,£10.60,In stock
Hyperbole and a Half: ...,Five,£14.75,In stock
"Hush, Hush (Hush, Hush ...",Three,£47.02,In stock
Hold Your Breath (Search ...,One,£28.82,In stock
Hamilton: The Revolution,Three,£58.79,In stock
Greek Mythic History,Five,£10.23,In stock
God: The Most Unpleasant ...,Five,£30.03,In stock
Glory over Everything: Beyond ...,Three,£45.84,In stock
Feathers: Displays of Brilliant ...,Three,£49.05,In stock
Far & Away: Places ...,Four,£15.06,In stock
Every Last Word,Three,£46.47,In stock
Eligible (The Austen Project ...,Three,£27.09,In stock
El Deafo,Five,£57.62,In stock
Eight Hundred Grapes,Four,£14.39,In stock
Eaternity: More than 150 ...,Five,£51.75,In stock
"Eat Fat, Get Thin",Two,£54.07,In stock
Don't Get Caught,One,£55.35,In stock
Doctor Sleep (The Shining ...,Two,£40.12,In stock
Demigods & Magicians: Percy ...,Five,£37.51,In stock
Dear Mr. Knightley,Five,£11.21,In stock
Daily Fantasy Sports,One,£36.58,In stock
Crazy Love: Overwhelmed by ...,Two,£47.72,In stock
Cometh the Hour (The ...,Three,£25.01,In stock
Code Name Verity (Code ...,Four,£22.13,In stock
Clockwork Angel (The Infernal ...,One,£44.14,In stock
City of Glass (The ...,Four,£56.02,In stock
City of Fallen Angels ...,Four,£11.23,In stock
City of Bones (The ...,One,£43.28,In stock
City of Ashes (The ...,One,£47.27,In stock
Cell,Four,£20.29,In stock
Catching Jordan (Hundred Oaks),Three,£50.83,In stock
"Carry On, Warrior: Thoughts ...",Three,£31.85,In stock
Carrie,Two,£46.23,In stock
Buying In: The Secret ...,Four,£37.80,In stock
Brain on Fire: My ...,Five,£49.32,In stock
Batman: Europa,Two,£32.01,In stock
Barefoot Contessa Back to ...,One,£28.01,In stock
Barefoot Contessa at Home: ...,Five,£50.62,In stock
Balloon Animals,Three,£17.03,In stock
Art Ops Vol. 1,Three,£48.80,In stock
Aristotle and Dante Discover ...,Four,£58.14,In stock
Angels Walking (Angels Walking ...,Two,£34.20,In stock
Angels & Demons (Robert ...,Three,£51.48,In stock
All the Light We ...,Five,£29.87,In stock
Adulthood Is a Myth: ...,Two,£10.90,In stock
Abstract City,Five,£56.37,In stock
A Time of Torment ...,Five,£48.35,In stock
A Study in Scarlet ...,Two,£16.73,In stock
A Series of Catastrophes ...,Two,£56.48,In stock
A People's History of ...,Two,£40.79,In stock
A Man Called Ove,One,£39.72,In stock
A Distant Mirror: The ...,Three,£14.58,In stock
A Brush of Wings ...,One,£55.51,In stock
1491: New Revelations of ...,Three,£21.80,In stock
"The Three Searches, Meaning, ...",Three,£13.33,In stock
Searching for Meaning in ...,One,£38.73,In stock
Rook,Four,£37.86,In stock
My Kitchen Year: 136 ...,Two,£11.53,In stock
13 Hours: The Inside ...,One,£27.06,In stock
Will You Won't You ...,Three,£13.86,In stock
Tipping Point for Planet ...,One,£37.55,In stock
The Star-Touched Queen,Five,£32.30,In stock
The Silent Sister (Riley ...,Five,£46.29,In stock
The Midnight Watch: A ...,One,£26.20,In stock
The Lonely City: Adventures ...,Two,£33.26,In stock
The Gray Rhino: How ...,Four,£59.15,In stock
The Golden Condom: And ...,One,£39.43,In stock
The Epidemic (The Program ...,Five,£14.44,In stock
The Dinner Party,Two,£56.54,In stock
The Diary of a ...,Three,£59.90,In stock
The Children,Three,£11.88,In stock
Stars Above (The Lunar ...,Two,£48.05,In stock
Snatched: How A Drug ...,Three,£21.21,In stock
Raspberry Pi Electronics Projects ...,Four,£49.67,In stock
Quench Your Own Thirst: ...,One,£43.14,In stock
Psycho: Sanitarium (Psycho #1.5),Five,£36.97,In stock
Poisonous (Max Revere Novels ...,Three,£26.80,In stock
One with You (Crossfire ...,Four,£15.71,In stock
No Love Allowed (Dodge ...,Four,£54.65,In stock
Murder at the 42nd ...,Four,£54.36,In stock
Most Wanted,Three,£35.28,In stock
"Love, Lies and Spies",Two,£20.55,In stock
How to Speak Golf: ...,Five,£58.32,In stock
Hide Away (Eve Duncan ...,One,£11.84,In stock
Furiously Happy: A Funny ...,Four,£41.46,In stock
Everyday Italian: 125 Simple ...,Five,£20.10,In stock
Equal Is Unfair: America's ...,One,£56.86,In stock
Eleanor & Park,Five,£56.51,In stock
Dirty (Dive Bar #1),Four,£40.83,In stock
Can You Keep a ...,One,£48.64,In stock
Boar Island (Anna Pigeon ...,Three,£59.48,In stock
A Paris Apartment,Four,£39.01,In stock
A la Mode: 120 ...,One,£38.77,In stock
Troublemaker: Surviving Hollywood and ...,Two,£48.39,In stock
The Widow,Two,£27.26,In stock
The Sleep Revolution: Transforming ...,Four,£11.68,In stock
The Improbability of Love,One,£59.45,In stock
The Art of Startup ...,Three,£21.00,In stock
Take Me Home Tonight ...,Three,£53.98,In stock
Sleeping Giants (Themis Files ...,One,£48.74,In stock
Setting the World on ...,Two,£21.15,In stock
Playing with Fire,Three,£13.71,In stock
Off the Hook (Fishing ...,Three,£47.67,In stock
Mothering Sunday,Two,£13.34,In stock
"Mother, Can You Not?",Five,£16.89,In stock
M Train,One,£27.18,In stock
Lilac Girls,Two,£17.28,In stock
Lies and Other Acts ...,One,£45.14,In stock
Lab Girl,One,£40.85,In stock
Keep Me Posted,Four,£20.46,In stock
It Didn't Start with ...,Three,£56.27,In stock
Grey (Fifty Shades #4),Four,£48.49,In stock
"Exit, Pursued by a ...",Four,£51.34,In stock
Daredevils,Three,£16.34,In stock
Cravings: Recipes for What ...,Three,£20.50,In stock
Born for This: How ...,Five,£21.59,In stock
Arena,Four,£21.36,In stock
Adultery,Five,£20.88,In stock
A Mother's Reckoning: Living ...,Three,£19.53,In stock
A Gentleman's Position (Society ...,Five,£14.75,In stock
11/22/63,Three,£48.48,In stock
10% Happier: How I ...,Two,£24.57,In stock
10-Day Green Smoothie Cleanse: ...,Five,£49.71,In stock
Without Shame,Five,£48.27,In stock
Watchmen,Four,£58.05,In stock
Unlimited Intuition Now,Four,£58.87,In stock
Underlying Notes,Two,£11.82,In stock
The Shack,One,£28.03,In stock
The New Brand You: ...,Five,£44.05,In stock
The Moosewood Cookbook: Recipes ...,Four,£12.34,In stock
The Flowers Lied,Two,£16.68,In stock
The Fabric of the ...,One,£55.91,In stock
The Book of Mormon,Three,£24.57,In stock
The Art and Science ...,Five,£52.98,In stock
The Alien Club,One,£54.40,In stock
Suzie Snowflake: One beautiful ...,Five,£54.81,In stock
Nap-a-Roo,One,£25.08,In stock
NaNo What Now? Finding ...,Four,£10.41,In stock
Modern Day Fables,Two,£47.44,In stock
If I Gave You ...,One,£20.91,In stock
"Fruits Basket, Vol. 9 ...",Four,£33.95,In stock
Dress Your Family in ...,Three,£43.68,In stock
Don't Forget Steven,One,£33.23,In stock
Chernobyl 01:23:40: The Incredible ...,Two,£35.92,In stock
Art and Fear: Observations ...,Four,£48.63,In stock
A Shard of Ice ...,Three,£56.63,In stock
A Hero's Curse (The ...,Three,£50.49,In stock
23 Degrees South: A ...,Two,£35.79,In stock
Zero to One: Notes ...,Three,£34.06,In stock
Why Not Me?,One,£17.76,In stock
When Breath Becomes Air,Two,£39.36,In stock
Vagabonding: An Uncommon Guide ...,Two,£36.94,In stock
The Unlikely Pilgrimage of ...,Five,£43.62,In stock
The New Drawing on ...,Three,£43.02,In stock
"The Midnight Assassin: Panic, ...",Four,£28.45,In stock
The Martian (The Martian ...,Two,£41.39,In stock
The High Mountains of ...,One,£51.15,In stock
The Grownup,One,£35.88,In stock
The E-Myth Revisited: Why ...,One,£36.91,In stock
South of Sunshine,One,£28.93,In stock
Smarter Faster Better: The ...,Five,£38.89,In stock
Silence in the Dark ...,Three,£58.33,In stock
Shadows of the Past ...,Five,£39.67,In stock
Roller Girl,Five,£14.10,In stock
Rising Strong,Three,£21.82,In stock
Proofs of God: Classical ...,One,£54.21,In stock
Please Kill Me: The ...,Four,£31.19,In stock
Out of Print: City ...,Five,£53.64,In stock
My Life Next Door ...,Five,£36.39,In stock
Miller's Valley,Two,£58.54,In stock
Man's Search for Meaning,Three,£29.48,In stock
Love That Boy: What ...,Two,£25.06,In stock
Living Forward: A Proven ...,Three,£12.55,In stock
Les Fleurs du Mal,Five,£29.04,In stock
Left Behind (Left Behind ...,Two,£40.72,In stock
Kill 'Em and Leave: ...,Five,£45.05,In stock
Kierkegaard: A Christian Missionary ...,One,£47.13,In stock
John Vassos: Industrial Design ...,Four,£20.22,In stock
I'll Give You the ...,One,£56.48,In stock
I Will Find You,One,£44.21,In stock
Hystopia: A Novel,Four,£21.96,In stock
Howl and Other Poems,Two,£40.45,In stock
History of Beauty,Four,£10.29,In stock
Heaven is for Real: ...,Two,£52.86,In stock
Future Shock (Future Shock ...,Five,£55.65,In stock
Ender's Game (The Ender ...,One,£43.64,In stock
Diary of a Citizen ...,One,£28.41,In stock
Death by Leisure: A ...,Four,£37.51,In stock
Brilliant Beacons: A History ...,Three,£11.45,In stock
Brazen: The Courage to ...,Two,£19.22,In stock
Between the World and ...,Four,£56.91,In stock
Being Mortal: Medicine and ...,Four,£55.06,In stock
A Murder Over a ...,Three,£13.20,In stock
32 Yolks,Two,£53.63,In stock
"""Most Blessed of the ...",Five,£44.48,In stock
You Are a Badass: ...,Three,£12.08,In stock
Wildlife of New York: ...,Two,£22.14,In stock
What Happened on Beale ...,Five,£25.37,In stock
Unreasonable Hope: Finding Faith ...,Two,£46.33,In stock
Under the Tuscan Sun,Three,£37.33,In stock
Toddlers Are A**holes: It's ...,One,£25.55,In stock
The Year of Living ...,One,£34.72,In stock
The Whale,Four,£35.96,In stock
The Story of Art,Four,£41.14,In stock
The Origin of Species,Four,£10.01,In stock
The Great Gatsby,Four,£36.05,In stock
The Good Girl,Three,£49.03,In stock
The Glass Castle,One,£16.24,In stock
The Faith of Christopher ...,One,£39.55,In stock
The Drowning Girls,Three,£35.67,In stock
The Constant Princess (The ...,Three,£16.62,In stock
The Bourne Identity (Jason ...,Four,£42.78,In stock
The Bachelor Girl's Guide ...,Five,£52.30,In stock
The Art Book,Two,£32.34,In stock
The 7 Habits of ...,Four,£33.17,In stock
Team of Rivals: The ...,Five,£20.12,In stock
Steal Like an Artist: ...,Two,£20.90,In stock
"Sit, Stay, Love",Three,£20.90,In stock
Sister Dear,Four,£40.20,In stock
"Shrunken Treasures: Literary Classics, ...",Three,£52.87,In stock
"Rich Dad, Poor Dad",One,£51.74,In stock
Raymie Nightingale,Two,£34.41,In stock
Playing from the Heart,One,£32.38,In stock
Nightstruck: A Novel,Four,£50.35,In stock
Naturally Lean: 125 Nourishing ...,Five,£11.38,In stock
Meternity,Three,£43.58,In stock
Memoirs of a Geisha,Three,£49.67,In stock
Like Never Before (Walker ...,Two,£28.77,In stock
Life of Pi,Four,£13.22,In stock
Leave This Song Behind: ...,Five,£51.17,In stock
King's Folly (The Kinsman ...,Five,£39.61,In stock
John Adams,Four,£57.43,In stock
How to Cook Everything ...,Four,£46.01,In stock
How to Be a ...,Two,£28.25,In stock
Good in Bed (Cannie ...,Five,£37.05,In stock
"Fruits Basket, Vol. 7 ...",One,£19.57,In stock
For the Love: Fighting ...,Three,£45.13,In stock
Finding God in the ...,Two,£46.64,In stock
Every Heart a Doorway ...,Five,£12.16,In stock
Delivering the Truth (Quaker ...,Four,£20.89,In stock
Counted With the Stars ...,Five,£17.97,In stock
"Chronicles, Vol. 1",Two,£52.60,In stock
Blue Like Jazz: Nonreligious ...,One,£25.77,In stock
Benjamin Franklin: An American ...,Three,£48.19,In stock
At The Existentialist Café: ...,Five,£29.93,In stock
A Summer In Europe,Two,£44.34,In stock
A Short History of ...,Five,£52.40,In stock
A Gathering of Shadows ...,Four,£44.81,In stock
The Sound Of Love,Five,£57.84,In stock
The Rise and Fall ...,Two,£39.67,In stock
The Perks of Being ...,Three,£55.02,In stock
The Mysterious Affair at ...,Four,£24.80,In stock
The Man Who Mistook ...,Four,£59.45,In stock
The Makings of a ...,Two,£31.58,In stock
The Joy of Cooking,Four,£43.27,In stock
The Invention of Wings,One,£37.34,In stock
